{
  "schema_version": "1.0.0",
  "catalog_id": "public-source-machine-pilot-v1",
  "evidence_class": "public-source-machine-pilot",
  "release_eligible": false,
  "release_status": "insufficient_evidence",
  "intake_report": {
    "path": "intake-report.md",
    "sha256": "bf21470b33ce6aec2c3643de070d7de5aa720160f6261a13c6c810f8089dac08"
  },
  "items": [
    {
      "pilot_id": "PF-TR-01",
      "status": "pilot-admitted",
      "repository": "clintecker/press",
      "commit": "5848b6990d6632c0d543a861af590036e9dc8533",
      "stratum": "transaction/order/payment",
      "acquired_at": "2026-08-31T18:23:03.336Z",
      "source": {
        "source_id": "source-pf-tr-01",
        "path": "cases/pf-tr-01/source/DIRECT-ORDERING-PLAN.md",
        "sha256": "601219c4a4abcb883b5d487b7267c7c24e614506ef2c29dc893b975bf9489e1c",
        "content_digest": "601219c4a4abcb883b5d487b7267c7c24e614506ef2c29dc893b975bf9489e1c",
        "upstream_url": "https://raw.githubusercontent.com/clintecker/press/5848b6990d6632c0d543a861af590036e9dc8533/docs/DIRECT-ORDERING-PLAN.md"
      },
      "license": {
        "path": "cases/pf-tr-01/license/LICENSE",
        "sha256": "707445a9840fb3e9321d712a456d7d833f41baf777719bd9877676bfddd9f38c",
        "upstream_url": "https://raw.githubusercontent.com/clintecker/press/5848b6990d6632c0d543a861af590036e9dc8533/LICENSE",
        "reported_license": "MIT",
        "scope_decision": "applicable"
      },
      "provenance": {
        "path": "cases/pf-tr-01/provenance.json",
        "sha256": "d249c0ff77357e1cfba789192980a4da3716742adf68d9cef917e1fc303fbc17"
      },
      "task": {
        "task_id": "task-pf-tr-01",
        "path": "cases/pf-tr-01/task.json",
        "sha256": "d7397de75d6eba2cca31a3779e0e1bf8f60ecdb1c4777ad613dac2d1fdac1a11",
        "source_id": "source-pf-tr-01",
        "scope": "Direct ordering payment capture, fulfillment, and idempotent order processing"
      },
      "reviews": [
        {
          "review_id": "machine-expert-a-v3:PF-TR-01",
          "report_id": "machine-expert-a-v3",
          "reviewer_class": "machine-agent",
          "review_scope": "intake-only",
          "source_id": "source-pf-tr-01",
          "task_id": "task-pf-tr-01",
          "decision": "admit"
        },
        {
          "review_id": "machine-expert-b-v3:PF-TR-01",
          "report_id": "machine-expert-b-v3",
          "reviewer_class": "machine-agent",
          "review_scope": "intake-only",
          "source_id": "source-pf-tr-01",
          "task_id": "task-pf-tr-01",
          "decision": "admit"
        },
        {
          "review_id": "machine-adjudication-v3:PF-TR-01",
          "report_id": "machine-adjudication-v3",
          "reviewer_class": "machine-agent",
          "review_scope": "intake-only",
          "source_id": "source-pf-tr-01",
          "task_id": "task-pf-tr-01",
          "decision": "admit"
        }
      ],
      "defects": []
    },
    {
      "pilot_id": "PF-TR-02",
      "status": "pilot-admitted",
      "repository": "profullstack/coinpayportal",
      "commit": "13f160c0897168931e407eccd6411e88946d0f23",
      "stratum": "transaction/order/payment",
      "acquired_at": "2026-08-31T18:23:03.336Z",
      "source": {
        "source_id": "source-pf-tr-02",
        "path": "cases/pf-tr-02/source/PRD.md",
        "sha256": "f27845a7705879333c1140ebac231ce339c71198c2f3eb77bf177c475b935273",
        "content_digest": "f27845a7705879333c1140ebac231ce339c71198c2f3eb77bf177c475b935273",
        "upstream_url": "https://raw.githubusercontent.com/profullstack/coinpayportal/13f160c0897168931e407eccd6411e88946d0f23/PRD.md"
      },
      "license": {
        "path": "cases/pf-tr-02/license/LICENSE",
        "sha256": "de1b680e8cf8ebf3641646e14f5c0730f726da2d9d6d211d498032c20d0d9e2c",
        "upstream_url": "https://raw.githubusercontent.com/profullstack/coinpayportal/13f160c0897168931e407eccd6411e88946d0f23/LICENSE",
        "reported_license": "MIT",
        "scope_decision": "applicable"
      },
      "provenance": {
        "path": "cases/pf-tr-02/provenance.json",
        "sha256": "7cc7436bb79cf6273c0af8588a3e298582ec041964e0031717f8ddc81e687990"
      },
      "task": {
        "task_id": "task-pf-tr-02",
        "path": "cases/pf-tr-02/task.json",
        "sha256": "58438f619573522601b78f829c1ce5051ccec108f0e3d714bcaba9d31d920109",
        "source_id": "source-pf-tr-02",
        "scope": "CoinPay checkout gateway and merchant plugin payment processing"
      },
      "reviews": [
        {
          "review_id": "machine-expert-a-v3:PF-TR-02",
          "report_id": "machine-expert-a-v3",
          "reviewer_class": "machine-agent",
          "review_scope": "intake-only",
          "source_id": "source-pf-tr-02",
          "task_id": "task-pf-tr-02",
          "decision": "admit"
        },
        {
          "review_id": "machine-expert-b-v3:PF-TR-02",
          "report_id": "machine-expert-b-v3",
          "reviewer_class": "machine-agent",
          "review_scope": "intake-only",
          "source_id": "source-pf-tr-02",
          "task_id": "task-pf-tr-02",
          "decision": "admit"
        },
        {
          "review_id": "machine-adjudication-v3:PF-TR-02",
          "report_id": "machine-adjudication-v3",
          "reviewer_class": "machine-agent",
          "review_scope": "intake-only",
          "source_id": "source-pf-tr-02",
          "task_id": "task-pf-tr-02",
          "decision": "admit"
        }
      ],
      "defects": []
    },
    {
      "pilot_id": "PF-TR-03",
      "status": "pilot-admitted",
      "repository": "unbrowse-ai/unbrowse",
      "commit": "e844f8f6af03b2ca9f0c466ac2262efceb2cf8ca",
      "stratum": "transaction/order/payment",
      "acquired_at": "2026-08-31T20:10:30Z",
      "source": {
        "source_id": "source-pf-tr-03",
        "path": "cases/pf-tr-03/source/prd.md",
        "sha256": "5d098a0efd0a24570c245894532d46a273c4716b5f429fe026b4bbbfd96cd755",
        "content_digest": "5d098a0efd0a24570c245894532d46a273c4716b5f429fe026b4bbbfd96cd755",
        "upstream_url": "https://raw.githubusercontent.com/unbrowse-ai/unbrowse/e844f8f6af03b2ca9f0c466ac2262efceb2cf8ca/docs/architecture/ACCEPTANCE-CRITERIA.md"
      },
      "license": {
        "path": "cases/pf-tr-03/license/LICENSE",
        "sha256": "53ba032af8ce6e762d8a0f97b1c946bc49d1f9edf9fee41a3555c2eb1ed907c2",
        "upstream_url": "https://raw.githubusercontent.com/unbrowse-ai/unbrowse/e844f8f6af03b2ca9f0c466ac2262efceb2cf8ca/LICENSE",
        "reported_license": "MIT",
        "scope_decision": "applicable"
      },
      "provenance": {
        "path": "cases/pf-tr-03/provenance.json",
        "sha256": "a25101542f5e65b54c54d6a840d4196941bd8cee75d008b07fde8d590bf805a8"
      },
      "task": {
        "task_id": "task-pf-tr-03",
        "path": "cases/pf-tr-03/task.json",
        "sha256": "890d5fbf68a97f486ed54702ae91fa00225925ed4c2119a4f26f9c55cc297ad9",
        "source_id": "source-pf-tr-03",
        "scope": "Unbrowse paid-route admission, Stripe/crypto subscription checkout, x402 retries, and payment settlement"
      },
      "reviews": [
        {
          "review_id": "machine-expert-a-v3:PF-TR-03",
          "report_id": "machine-expert-a-v3",
          "reviewer_class": "machine-agent",
          "review_scope": "intake-only",
          "source_id": "source-pf-tr-03",
          "task_id": "task-pf-tr-03",
          "decision": "admit"
        },
        {
          "review_id": "machine-expert-b-v3:PF-TR-03",
          "report_id": "machine-expert-b-v3",
          "reviewer_class": "machine-agent",
          "review_scope": "intake-only",
          "source_id": "source-pf-tr-03",
          "task_id": "task-pf-tr-03",
          "decision": "admit"
        },
        {
          "review_id": "machine-adjudication-v3:PF-TR-03",
          "report_id": "machine-adjudication-v3",
          "reviewer_class": "machine-agent",
          "review_scope": "intake-only",
          "source_id": "source-pf-tr-03",
          "task_id": "task-pf-tr-03",
          "decision": "admit"
        }
      ],
      "defects": []
    },
    {
      "pilot_id": "PF-TR-04",
      "status": "pilot-admitted",
      "repository": "chuhemiao/agentic-transaction-firewall",
      "commit": "b652229d87d4e5b8f732184c779fb54ed83dd2bf",
      "stratum": "transaction/order/payment",
      "acquired_at": "2026-08-31T18:23:03.336Z",
      "source": {
        "source_id": "source-pf-tr-04",
        "path": "cases/pf-tr-04/source/PRD.md",
        "sha256": "e9ca0dcdee3a78788d420e54b51cd8b81963aae8aa476886c3a73277318cd5b8",
        "content_digest": "e9ca0dcdee3a78788d420e54b51cd8b81963aae8aa476886c3a73277318cd5b8",
        "upstream_url": "https://raw.githubusercontent.com/chuhemiao/agentic-transaction-firewall/b652229d87d4e5b8f732184c779fb54ed83dd2bf/docs/PRD.md"
      },
      "license": {
        "path": "cases/pf-tr-04/license/LICENSE",
        "sha256": "cfc7749b96f63bd31c3c42b5c471bf756814053e847c10f3eb003417bc523d30",
        "upstream_url": "https://raw.githubusercontent.com/chuhemiao/agentic-transaction-firewall/b652229d87d4e5b8f732184c779fb54ed83dd2bf/LICENSE",
        "reported_license": "Apache-2.0",
        "scope_decision": "applicable"
      },
      "provenance": {
        "path": "cases/pf-tr-04/provenance.json",
        "sha256": "0bd22981d3149531f0ea533a77e560949a71f2696bbb18bc86393ff764ae794d"
      },
      "task": {
        "task_id": "task-pf-tr-04",
        "path": "cases/pf-tr-04/task.json",
        "sha256": "66a8ec95cab2a0646aacf17f4db2d18c67f7e06bc0750f7db53163ab54fde70a",
        "source_id": "source-pf-tr-04",
        "scope": "Agent payment intent authorization, transaction policy decisions, and constrained execution"
      },
      "reviews": [
        {
          "review_id": "machine-expert-a-v3:PF-TR-04",
          "report_id": "machine-expert-a-v3",
          "reviewer_class": "machine-agent",